{
 "schema_version": "0.1.0",
 "layer": "RAG evaluation set (retrieval-gated; generation metrics declared, not measured)",
 "vintage": "2026-10-30",
 "generated_at": "2026-10-30T22:44:54+00:00",
 "generator": {
  "script": "scripts/build_rag_corpus.py",
  "spec": "analysis/specs/rag_eval.yml",
  "git_sha": "a7519ee"
 },
 "corpus": "registry/rag/2026-10-30/corpus.json",
 "ragas": {
  "status": "not_run",
  "why": "This block describes the `ragas` *library*, which is not installed in this repository or on this machine: installing it would add a dependency tree to a project whose answering path deliberately has none. The four metric definitions it implements — faithfulness, answer relevancy, context precision and context recall — are implemented in `scripts/eval_answer_quality.py` and measured with a judge model in `answer_quality_eval.json`. Those scores are not comparable to a library run, because the prompt, the decomposition and the call pattern are this repository's.",
  "measured_elsewhere": "registry/rag/2026-10-30/answer_quality_eval.json",
  "metadata": [
   "question",
   "contexts",
   "answer",
   "ground_truth"
  ]
 },
 "counts": {
  "questions": 22,
  "answerable": 16,
  "refusal_with_reason": 2,
  "out_of_scope": 4
 },
 "questions": [
  {
   "id": "q01_fatalities_elasticity",
   "type": "answerable",
   "question": "What did the published estimate find for the effect of FAAC allocations on reported fatalities?",
   "gold_refs": [
    "card:fatalities__A"
   ],
   "gold_chunks": [
    "card:fatalities__A",
    "card:fatalities__A#p2",
    "card:fatalities__A#p3",
    "card:fatalities__A#p4",
    "card:fatalities__A#p5",
    "card:fatalities__A#p6",
    "card:fatalities__A#p7"
   ],
   "must_contain": [
    "+0.4678",
    "[-0.0833, +1.0189]"
   ],
   "refusal_must_cite": null,
   "reference_answer": "The published Design A specification is a PPML elasticity of fatalities to the logged gross FAAC allocation of +0.4678 (SE 0.2812), 95 % interval [-0.0833, +1.0189], p = 0.0962, on 3,888 state-months for 36 states from 2016-12 to 2025-12. The interval crosses zero and the verdict is `estimated_not_identified`.",
   "notes": null
  },
  {
   "id": "q02_fatalities_identified",
   "type": "answerable",
   "question": "Is the fatality estimate identified, and which check decided that?",
   "gold_refs": [
    "card:fatalities__A"
   ],
   "gold_chunks": [
    "card:fatalities__A",
    "card:fatalities__A#p2",
    "card:fatalities__A#p3",
    "card:fatalities__A#p4",
    "card:fatalities__A#p5",
    "card:fatalities__A#p6",
    "card:fatalities__A#p7"
   ],
   "must_contain": [
    "estimated_not_identified",
    "the lead-shift p-value is 0.167"
   ],
   "refusal_must_cite": null,
   "reference_answer": "No. The pre-declared rule requires a lead-shift p-value below 0.05 and a 24-month placebo smaller than the estimate; the lead-shift p-value is 0.167, with 10 of 60 mis-timed doses returning an estimate at least as large as the published one. The verdict is `estimated_not_identified`.",
   "notes": null
  },
  {
   "id": "q03_incidents_interval",
   "type": "answerable",
   "question": "What is the point estimate and 95 % interval for the effect on the number of reported incidents?",
   "gold_refs": [
    "card:incidents__A"
   ],
   "gold_chunks": [
    "card:incidents__A",
    "card:incidents__A#p2",
    "card:incidents__A#p3",
    "card:incidents__A#p4",
    "card:incidents__A#p5",
    "card:incidents__A#p6"
   ],
   "must_contain": [
    "+0.5278",
    "[+0.1467, +0.9088]"
   ],
   "refusal_must_cite": null,
   "reference_answer": "+0.5278 with a 95 % interval of [+0.1467, +0.9088], p = 0.0066, on the same 3,888 state-months. The interval excludes zero, but the same lead-shift check fails (p = 0.167), so the card still reads `estimated_not_identified`.",
   "notes": null
  },
  {
   "id": "q04_oil_to_states",
   "type": "answerable",
   "question": "How much of a Brent crude oil shock reaches state governments, and after how long?",
   "gold_refs": [
    "result:B"
   ],
   "gold_chunks": [
    "result:B",
    "result:B#p2",
    "result:B#p3",
    "result:B#p4",
    "result:B#p5",
    "result:B#p6",
    "result:B#p7",
    "result:B#p8",
    "result:B#p9"
   ],
   "must_contain": [
    "+0.5181",
    "cumulative log change in national FAAC"
   ],
   "refusal_must_cite": null,
   "reference_answer": "Design B is a local projection of the cumulative log change in national FAAC on the Brent shock. The response is -0.1600 at h = 0, +0.5181 at h = 2 (interval [+0.1919, +0.8443]) and +0.4698 at h = 3, so roughly a 10 % Brent move reaches the states as about 5 % more money two to three months later. Only h = 2 and h = 3 exclude zero.",
   "notes": null
  },
  {
   "id": "q05_design_b_robust",
   "type": "answerable",
   "question": "Did Design B's result survive the robustness grid?",
   "gold_refs": [
    "result:B",
    "doc:robustness#s02"
   ],
   "gold_chunks": [
    "result:B",
    "result:B#p2",
    "result:B#p3",
    "result:B#p4",
    "result:B#p5",
    "result:B#p6",
    "result:B#p7",
    "result:B#p8",
    "result:B#p9",
    "doc:robustness#s02",
    "doc:robustness#s02#p2",
    "doc:robustness#s02#p3",
    "doc:robustness#s02#p4",
    "doc:robustness#s02#p5",
    "doc:robustness#s02#p6"
   ],
   "must_contain": [
    "36 of 48"
   ],
   "refusal_must_cite": null,
   "reference_answer": "Its fiscal family did: all 24 of its 24 specifications are positive and every interval excludes zero. Across both outcome families the grid is 36 of 48 positive — the price-level family is 12 positive and 12 negative with no interval excluding zero. Its timing is weaker — the in-time placebo over 48 shifted alignments returns p = 0.0625, published as a bound rather than widened until it passed.",
   "notes": null
  },
  {
   "id": "q06_design_c_status",
   "type": "answerable",
   "question": "Was the synthetic control estimated, and what did its placebos find?",
   "gold_refs": [
    "result:C",
    "doc:estimates#s02",
    "doc:design-memo#s04"
   ],
   "gold_chunks": [
    "result:C",
    "result:C#p2",
    "doc:estimates#s02",
    "doc:estimates#s02#p10",
    "doc:estimates#s02#p11",
    "doc:estimates#s02#p12",
    "doc:estimates#s02#p13",
    "doc:estimates#s02#p14",
    "doc:estimates#s02#p15",
    "doc:estimates#s02#p16",
    "doc:estimates#s02#p17",
    "doc:estimates#s02#p18",
    "doc:estimates#s02#p2",
    "doc:estimates#s02#p3",
    "doc:estimates#s02#p4",
    "doc:estimates#s02#p5",
    "doc:estimates#s02#p6",
    "doc:estimates#s02#p7",
    "doc:estimates#s02#p8",
    "doc:estimates#s02#p9",
    "doc:design-memo#s04",
    "doc:design-memo#s04#p10",
    "doc:design-memo#s04#p11",
    "doc:design-memo#s04#p12",
    "doc:design-memo#s04#p2",
    "doc:design-memo#s04#p3",
    "doc:design-memo#s04#p4",
    "doc:design-memo#s04#p5",
    "doc:design-memo#s04#p6",
    "doc:design-memo#s04#p7",
    "doc:design-memo#s04#p8",
    "doc:design-memo#s04#p9"
   ],
   "must_contain": [
    "estimated_not_identified",
    "placebos"
   ],
   "refusal_must_cite": null,
   "reference_answer": "Estimated, and not identified. The donor pool was widened to 99 candidates and the gate passes u5mr on 3 of its 4 runnable windows; the estimator, the in-space and in-time placebos and the leave-one-donor-out sweep were then built. Four windows were estimated and none survived the declared rule: the in-space rank p runs from 0.17 to 0.50, and 304 of 396 placebo fits also clear the same pre-fit gate, so the gate does not discriminate on this pool.",
   "notes": null
  },
  {
   "id": "q07_u5mr_synthetic_control",
   "type": "answerable",
   "question": "Can you show me an estimate for under-5 mortality under the synthetic-control design?",
   "gold_refs": [
    "card:u5mr__C"
   ],
   "gold_chunks": [
    "card:u5mr__C",
    "card:u5mr__C#p2",
    "card:u5mr__C#p3",
    "card:u5mr__C#p4"
   ],
   "must_contain": [
    "design_estimated_not_identified"
   ],
   "refusal_must_cite": null,
   "reference_answer": "No number appears on the card. The synthetic control was run for under-5 mortality and no window survived its placebos, so the card carries the reason code `design_estimated_not_identified` and points at registry/design_c/ for the gaps, the placebos and the check that failed. A synthetic control has no sampling distribution, so there is no interval to put on a card.",
   "notes": null
  },
  {
   "id": "q08_observed_share",
   "type": "answerable",
   "question": "How much of the monthly data series is actually observed rather than interpolated?",
   "gold_refs": [
    "doc:limitations#s02"
   ],
   "gold_chunks": [
    "doc:limitations#s02",
    "doc:limitations#s02#p2"
   ],
   "must_contain": [
    "16.4 %"
   ],
   "refusal_must_cite": null,
   "reference_answer": "1,373 of 8,350 rows are observed (16.4 %); 4,389 are interpolated and 2,588 unobserved. The app draws interpolated months dashed and Stage 7 excludes them on a robustness axis.",
   "notes": null
  },
  {
   "id": "q09_tenure_comparison",
   "type": "answerable",
   "question": "Why can't you tell me whether PDP or APC tenures did better?",
   "gold_refs": [
    "doc:limitations#s01"
   ],
   "gold_chunks": [
    "doc:limitations#s01",
    "doc:limitations#s01#p2",
    "doc:limitations#s01#p3",
    "doc:limitations#s01#p4"
   ],
   "must_contain": [
    "arithmetic, not a null result"
   ],
   "refusal_must_cite": null,
   "reference_answer": "There are four to five administrations against 22–23 annual observations per outcome, and the mandated oil x tenure interactions are collinear with the tenure dummies at R² 0.997–0.999, so the smallest detectable effect is 35–99 residual standard deviations. It is a statement about arithmetic, not a null result.",
   "notes": null
  },
  {
   "id": "q10_flagged_series",
   "type": "answerable",
   "question": "How many of the landed series did the quality gates flag?",
   "gold_refs": [
    "doc:limitations#s04"
   ],